recipe_name,source_url,ingredients,directions,serving_size,nutrients
Pork tenderloin with fennel sauce,https://www.mayoclinic.org/healthy-lifestyle/recipes/pork-tenderloin-with-fennel-sauce/rcp-20049810,"4 pork tenderloin fillets, each 4 ounces,2 tablespoons olive oil,1 teaspoon fennel seeds,1 fennel bulb, cored and thinly sliced,1 sweet onion (Vidalia), thinly sliced,1/2 cup dry white wine,1 can (12 ounces) low-sodium chicken broth,Fennel fronds, for garnish,Orange slices, for garnish","Place the pork between sheets of wax paper. Pound each with a mallet or roll with a rolling pin until about 1/4-inch thick.,In a heavy, nonstick skillet, heat the oil over medium heat. Add the fennel seeds and stir until fragrant, about 3 minutes. Add the pork and cook until browned, about 3 minutes on each side. Remove the pork from the skillet and cover to keep warm.,Add the fennel and onion slices to the skillet. Saute until tender, about 5 minutes. Remove the vegetables from the skillet and cover to keep warm.,Add the wine and chicken broth to the skillet. Boil over high heat until reduced in half. Return the pork to the skillet, cover and cook over low heat for 5 minutes. Remove the cover and add the fennel and onion mixture. Cover and cook another 2 minutes. Serve on warmed plates garnished with fennel fronds and orange slices.",Serving size: 1 piece with vegetables,"Calories 276,Total fat 12g,Saturated fat 3g,Trans fat 0g,Monounsaturated fat 9g,Cholesterol 71mg,Sodium 122mg,Total carbohydrate 13g,Dietary fiber 3g,Total sugars 7g,Added sugars 0g,Protein 29g"
Portobello and blue cheese salad,https://www.mayoclinic.org/healthy-lifestyle/recipes/portobello-and-blue-cheese-salad/rcp-20049811,"1 teaspoon olive oil,2 large portobello mushrooms, stemmed, wiped clean and cut into bite-size pieces,4 slices red onion,1 teaspoon minced garlic,1 tablespoon merlot wine,6 stalks asparagus, cut into 1-inch sections,2 tablespoons crumbled blue cheese,2 tablespoons balsamic vinegar,1 tablespoon water,Freshly ground black pepper, to taste,6 cups chopped bibb lettuce,2 roasted red peppers (from a can), sliced,1/2 cup whole-wheat croutons","In a small pan, heat the olive oil over medium heat. Add the mushrooms and onions. Saute until the vegetables are tender, 4 to 6 minutes. Add the garlic and saute another minute — taking care not to burn the garlic. Add the wine and cook until it evaporates completely, about 1 minute.,In a pot fitted with a steamer basket, bring 1 inch of water to a boil. Add the asparagus. Cover and steam until tender-crisp, 2 to 3 minutes. Set aside.,In a small bowl, add the blue cheese, balsamic vinegar, water and black pepper. Whisk to mix thoroughly. (Just before drizzling the dressing over the salad, whisk again.),Add 3 cups of lettuce to each plate. Top each with 1/2 the mushroom mixture, 1/2 the asparagus, 1/2 the roasted red pepper, 1/2 the blue cheese dressing mixture and 1/4 cup croutons. Serve immediately.",Serving size: Half the salad,"Calories 190,Total fat 6g,Saturated fat 2g,Trans fat Trace,Monounsaturated fat 3g,Cholesterol 6mg,Sodium 173mg,Total carbohydrate 26g,Dietary fiber 7g,Total sugars 12g,Added sugars 0g,Protein 9g"
Prawns puttanesca,https://www.mayoclinic.org/healthy-lifestyle/recipes/prawns-puttanesca/rcp-20049913,"1 tablespoon olive oil,1 1/4 pounds prawns (about 16 large shrimp), peeled and deveined,1/2 teaspoon freshly ground black pepper,2 tablespoons dry white wine,4 tomatoes, peeled and seeded, then diced (about 2 1/2 cups),1/4 cup dry-packed sun-dried tomatoes, soaked in water to rehydrate, drained and chopped,3 cloves garlic, minced,1/4 cup chopped pitted Nicoise olives,1 tablespoon capers, rinsed and chopped,2 anchovy fillets, rinsed and finely chopped,1 tablespoon grated lemon zest,1 tablespoon chopped fresh flat-leaf (Italian) parsley,1 tablespoon chopped fresh basil,1/2 teaspoon red pepper flakes (optional)","In a large, nonstick saute or frying pan, heat the olive oil over medium-high heat. Add the prawns sprinkle with the black pepper, and cook for about 3 minutes. Turn the prawns and cook until opaque and pink, about 2 minutes longer. Transfer to a bowl and keep warm.,Add the wine and deglaze pan, stirring with a wooden spoon to scrape up any browned bits. Add the fresh and sun-dried tomatoes and the garlic. Reduce the heat to medium and simmer until the tomatoes are tender, about 3 minutes.,Add all the remaining ingredients and cook for about 2 minutes longer to allow the flavors to blend. Return the prawns to the pan and toss well to coat. Serve immediately.",Serving size: About 4 large shrimp and 3/4 cup sauce,"Calories 218,Total fat 6g,Saturated fat 1g,Trans fat Trace,Monounsaturated fat 3g,Cholesterol 229mg,Sodium 379mg,Total carbohydrate 10g,Dietary fiber 2g,Total sugars 1g,Added sugars 0g,Protein 31g"
Quiche,https://www.mayoclinic.org/healthy-lifestyle/recipes/quiche/rcp-20049698,"1/2 cup chopped onion,8 ounces chopped mushrooms,1 egg,2 egg whites,1/2 cup fat-free sour cream,3 ounces lean ham, chopped (about 1 1/4 cups),6 ounces shredded low-fat Swiss cheese,1 ready-made 9-inch pie crust","Heat the oven to 350 F.,Spray a skillet with cooking spray. Add the onions and mushrooms and cook over medium heat until tender.,In a large bowl, whisk together the egg, egg whites and sour cream. Stir in the sauteed onions, ham and cheese. Pour the mixture into the unbaked pie shell.,Bake until the quiche is set and lightly browned, about 40 minutes. Cut into 6 wedges and serve immediately.",Serving size: 1 wedge,"Total fat 10g,Calories 224,Protein 16g,Cholesterol 48mg,Total carbohydrate 16g,Dietary fiber 1g,Monounsaturated fat 4g,Saturated fat 3g,Added sugars 0g,Sodium 473mg,Trans fat Trace,Total sugars 3g"
Quick bean and tuna salad,https://www.mayoclinic.org/healthy-lifestyle/recipes/quick-bean-and-tuna-salad/rcp-20049996,"1/2 whole-grain baguette, torn into 2-inch pieces (about 1 cup),2 tablespoons olive oil,1 can (16 ounces) cannellini beans, no salt added, drained and rinsed,2 small dill pickles, cut into bite-size pieces (about 2 tablespoons),1 small red onion, thinly sliced (about 1/2 cup),2 tablespoons red wine vinegar,1/4 teaspoon pepper,1 can (7 ounces) water-packed tuna, no salt added, drained and rinsed,2 tablespoons finely chopped fresh parsley","Heat broiler. Place the baguette pieces on a heavy cookie sheet and brush with 1 tablespoon of the oil. Place under broiler for about 1 to 2 minutes, until golden. Turn the bread pieces and broil for an additional 1 or 2 minutes.,In a large bowl, combine the remaining oil, beans, pickles, onion, vinegar and pepper. Fold in the broiled baguette pieces. Divide the mixture among four bowls and top with the tuna and parsley.",Serving size: About 1 cup,"Total carbohydrate 23g,Dietary fiber 6g,Sodium 171mg,Saturated fat 1.5g,Total fat 10g,Trans fat 0g,Cholesterol 21mg,Protein 19g,Monounsaturated fat 5g,Calories 316,Added sugars 0g,Total sugars 6g"
Quinoa risotto with arugula and Parmesan,https://www.mayoclinic.org/healthy-lifestyle/recipes/quinoa-risotto-with-arugula-and-parmesan/rcp-20049874,"1 tablespoon olive oil,1/2 yellow onion, chopped (about 1/2 cup),1 garlic clove, minced,1 cup quinoa, well rinsed,2 1/4 cups low-sodium vegetable stock or broth,2 cups chopped, stemmed arugula (rocket),1 small carrot, peeled and finely shredded,1/2 cup thinly sliced fresh shiitake mushrooms,1/4 cup grated Parmesan cheese,1/4 teaspoon salt,1/4 teaspoon freshly ground black pepper","In a large saucepan, heat the olive oil over medium heat. Add the onion and saute until soft and translucent, about 4 minutes. Add the garlic and quinoa and cook for about 1 minute, stirring occasionally. Don't let the garlic brown.,Add the stock and bring to a boil. Reduce the heat to low and simmer until the quinoa is almost tender to the bite but slightly hard in the center, about 12 minutes. The mixture will be brothy. Stir in the arugula, carrot and mushrooms and simmer until the quinoa grains have turned from white to translucent, about 2 minutes longer.,Stir in the cheese and season with the salt and pepper. Serve immediately.",Serving size: About 1 cup,"Calories 161,Total fat 5g,Saturated fat 1g,Trans fat 0g,Monounsaturated fat 2g,Cholesterol 3mg,Sodium 211mg,Total carbohydrate 22g,Dietary fiber 3g,Total sugars 2g,Added sugars 0g,Protein 6g"
Quinoa salad,https://www.mayoclinic.org/healthy-lifestyle/recipes/quinoa-salad/rcp-20125126,"1 cup quinoa,1 1/4 cups water,1 lemon, juiced (about 2 tablespoons),1 garlic clove, minced,1/4 teaspoon ground black pepper,2 tablespoons olive or canola oil,1 large cucumber, seeded and cut into 1/2-inch pieces,1 pint cherry tomatoes, halved,1/3 cup chopped parsley,1/4 cup chopped red onion,1/2 cup reduced-fat feta cheese","In a medium saucepan over high heat, bring quinoa and water to a boil. Reduce heat to medium-low and cover. Simmer for about 10 minutes or until the quinoa is tender.,Remove quinoa from heat and let stand, covered, for 5 minutes. Then fluff quinoa with a fork and spread it out onto a large rimmed baking sheet to cool.,In a small bowl, whisk lemon juice, garlic and pepper. Gradually whisk in oil.,After the quinoa has cooled, transfer it to a large bowl and add the dressing, cucumber, tomatoes, parsley and onion. Top with feta cheese and toss gently to mix.",Serving size: About 2 cups,"Calories 313,Total fat 13g,Saturated fat 3g,Trans fat 0g,Monounsaturated fat 5g,Cholesterol 10mg,Sodium 177mg,Total carbohydrate 40g,Dietary fiber 6g,Added sugars 0g,Protein 9g"
Quinoa stuffed peppers,https://www.mayoclinic.org/healthy-lifestyle/recipes/stuffed-quinoa-peppers/rcp-20197761,"1 cup uncooked quinoa,1 tablespoon olive oil,1 cup chopped zucchini,2 cups chopped tomato,1/2 cup chopped onion,1 stalk celery, chopped,2 tablespoons chopped walnuts,3 garlic cloves, chopped,2 teaspoons chopped fresh thyme,1 teaspoon salt,1/2 teaspoon ground black pepper,2 teaspoons Parmesan cheese,2 large bell peppers, cut in half","Heat the oven to 350 F. Cook quinoa according to package directions. Set aside.,Heat a large saute pan to medium-high heat. Add oil, zucchini, tomatoes, onion, celery, walnuts, garlic and thyme. Reduce heat to medium after 2 minutes. Once vegetables are tender, add cooked quinoa, salt, pepper and cheese.,Place the pepper halves on a baking sheet. Place 1/2 cup of the quinoa and vegetable mixture into each pepper half. Cover with foil and bake for 15 to 20 minutes. Uncover and bake for an additional 5 minutes until peppers are cooked to desired doneness.",Serving size: 1 pepper half,"Calories 313,Total fat 13g,Saturated fat 3g,Trans fat 0g,Monounsaturated fat 4g,Cholesterol 9mg,Sodium 674mg,Total carbohydrate 38g,Dietary fiber 7g,Total sugars 10g,Protein 13g,Added sugars 0g"
Rancher's eggs,https://www.mayoclinic.org/healthy-lifestyle/recipes/ranchers-eggs/rcp-20122254,"6 whole-grain corn tortillas (6-inch diameter),1 can (15 ounces) reduced-sodium black beans, rinsed and drained,1 teaspoon ground cumin,6 large eggs or 1 1/2 cups egg substitute,1/2 cup grated reduced-fat cheddar and Monterey Jack cheese blend,6 tablespoons purchased fresh salsa","Heat oven to 350 F. Spray 6 (8-ounce) custard cups with cooking spray and place on a cookie sheet.,Place tortillas in the microwave and heat for about 25 seconds or until they are warm and flexible. Gently press a tortilla into each cup. Spray the tops of the tortillas with cooking spray.,Place beans in a small bowl and mash coarsely with a fork or potato masher. Add cumin and stir until combined.,Spoon the bean mixture into tortillas, dividing evenly. Crack 1 egg into each tortilla on top of the beans.,Place cookie sheet with egg cups in the oven and bake for about 24 to 27 minutes, or until the egg whites are set and the yolks are soft.,Sprinkle each egg with grated cheese and return to oven for an additional minute or until the cheese is melted.,Remove eggs from oven and run a table knife around the tortillas to loosen them from the custard cups. Then transfer to plates. Top with fresh salsa and serve immediately.",Serving size: 1 filled tortilla,"Cholesterol 190mg,Calories 292,Sodium 614mg,Total fat 10.5g,Total carbohydrate 32g,Saturated fat 4.5g,Dietary fiber 9g,Trans fat Trace,Added sugars 0g,Monounsaturated fat 3.5g,Protein 17g,Total sugars 2g,Potassium 452mg"
Rice and beans salad,https://www.mayoclinic.org/healthy-lifestyle/recipes/rice-and-beans-salad/rcp-20049942,"1 1/2 cups uncooked brown rice,3 cups water,1/2 cup chopped fresh parsley,1/2 cup chopped shallots or spring onions (approximately 2 shallots or several spring onions),15-ounce can unsalted garbanzo beans,15-ounce can unsalted dark kidney beans,1/4 cup olive oil,1/3 to 1/2 cup rice vinegar, according to your taste","Place rice and water in stockpot. Cover and cook over medium heat until rice is tender, about 45 to 50 minutes. Cool to room temperature. Stir in the remaining ingredients. Chill 2 hours or longer.",Serving size: About 3/4 cup,"Total carbohydrate 34g,Dietary fiber 5g,Sodium 110mg,Saturated fat 1g,Total fat 7g,Cholesterol 0mg,Protein 7g,Monounsaturated fat 4g,Calories 227,Trans fat 0g,Total sugars 3g,Added sugars 0g"
Rice noodles with spring vegetables,https://www.mayoclinic.org/healthy-lifestyle/recipes/rice-noodles-with-spring-vegetables/rcp-20049651,"1 package (8 ounces) rice noodles,1 tablespoon peanut oil,1 tablespoon sesame oil,1 tablespoon grated fresh ginger,2 garlic cloves, finely chopped,2 tablespoons reduced-sodium soy sauce,1 cup small broccoli florets,1 cup fresh bean sprouts,8 cherry tomatoes, halved,1 cup chopped fresh spinach,2 scallions, chopped,Crushed red chili flakes (optional)","Fill a large pot 3/4 full with water and bring to a boil. Add the noodles and cook until tender, 5 to 6 minutes, or according to the package directions. Drain and rinse the noodles thoroughly with cold water. Set aside.,In a large pot or frying pan, heat the oils over medium heat. Add ginger and garlic and stir-fry until fragrant. Stir in the soy sauce and broccoli and continue to cook over medium heat for about 3 minutes. Add remaining vegetables and cooked noodles, and toss until warmed through.,Divide the noodles among warmed plates and top with crushed red chili flakes, if desired. Serve immediately.",Serving size: About 1 1/2 cups,"Cholesterol 0mg,Calories 201,Sodium 222mg,Total fat 5g,Total carbohydrate 37g,Saturated fat 1g,Dietary fiber 1g,Trans fat 0g,Added sugars 0g,Monounsaturated fat 2g,Protein 4g,Total sugars 0g"
Roasted Cornish hen,https://www.mayoclinic.org/healthy-lifestyle/recipes/roasted-cornish-hen/rcp-20197741,"2 pounds Cornish hen,1 orange, thinly sliced,2 garlic cloves, finely chopped,1 teaspoon finely chopped fresh thyme,1 teaspoon finely chopped fresh rosemary,3/4 teaspoon kosher salt,1/4 teaspoon ground black pepper","Heat oven to 375 F. Place the hen in a baking dish that is 2 inches deep. Stuff hen with orange slices, half the garlic and half the herbs. Gently slide the remaining garlic, herbs, salt and pepper underneath the skin around both sides of the hen.,Bake for 30 to 45 minutes, until the internal temperature reaches 160 F. Cover the pan with aluminum foil and allow the hen to rest for 10 to 15 minutes. It will continue to cook as it rests so the internal temperature reaches 165 F. To serve, cut the hen in half, remove the skin, and then cut into quarters.",Serving size: 4 ounces,"Calories 150,Total fat 4g,Saturated fat 1g,Trans fat 0g,Monounsaturated fat 1g,Cholesterol 103mg,Sodium 446mg,Total carbohydrate 5g,Dietary fiber 1g,Total sugars 3g,Protein 23g"
Roasted red pepper and chicken wrap,https://www.mayoclinic.org/healthy-lifestyle/recipes/roasted-red-pepper-and-chicken-wrap/rcp-20049703,"4 ounces boneless, skinless chicken breast, cut into strips 1/2 inch wide and 2 inches long,2 10-inch flour tortillas,2 tablespoons hummus,1 cup shredded lettuce,1/2 cup chopped tomatoes,1 roasted red bell pepper, peeled and cut into slices","Spray a small nonstick frying pan with cooking spray. Add the chicken and saute over medium-high heat until the chicken is lightly browned and opaque throughout. Set aside.,Heat a dry, large frying pan (without a nonstick surface) over medium heat. Add 1 tortilla to the hot pan and heat until softened, about 20 seconds per side. Repeat with the other tortilla.,To serve, place a warmed tortilla on each plate. Spread 1 tablespoon of the hummus on each tortilla. Then add half of the chicken, lettuce, tomatoes and roasted pepper to make each wrap. Fold in the sides, fold the bottom of the tortilla up over the filling and then roll to close. Cut each wrap in half crosswise and serve immediately.",Serving size: 1 wrap,"Calories 358,Total fat 8g,Saturated fat 2g,Trans fat Trace,Monounsaturated fat 4g,Cholesterol 41mg,Sodium 415mg,Total carbohydrate 50g,Dietary fiber 5g,Added sugars 0g,Protein 21g,Total sugars 4g"
Roasted red snapper,https://www.mayoclinic.org/healthy-lifestyle/recipes/roasted-red-snapper/rcp-20049858,"1/4 cup fresh orange juice,1/2 cup fresh lime juice,1/2 teaspoon grated orange zest,1/2 teaspoon grated lime zest,3 shallots or 1/2 red onion, chopped (about 1/4 cup),2 tablespoons olive oil or canola oil, divided,1 small whole red snapper, about 1 1/2 pounds, cleaned and scaled, head and tail left on,2 garlic cloves, coarsely chopped,2 tablespoons chopped fresh basil,2 tablespoons chopped fresh mint,1 tablespoon chopped fresh thyme,1/2 teaspoon coarsely ground black pepper,1 small leek, including tender green top, halved lengthwise and cut crosswise into 1 1/2-inch pieces,2 large tomatoes, cut crosswise into slices 1/2-inch thick,1/4 teaspoon salt","In a shallow glass baking dish, make a marinade by combining the orange and lime juices, orange and lime zests, shallots, and 1 tablespoon of the oil. Score the skin of the fish in a diamond pattern. Add the fish to the marinade and turn once to coat. Cover and refrigerate for 30 minutes, turning the fish occasionally.,Heat the oven to 425 F. Lightly coat a shallow baking dish with cooking spray.,In a blender or small food processor, combine the garlic, basil, mint, thyme, remaining 1 tablespoon of oil, and 1/4 teaspoon of the pepper. Pulse to puree. In a small bowl, combine half the herb paste with the leek. Toss gently to mix.,Sprinkle the leek mixture evenly over the bottom of the prepared baking dish. Top with the tomato slices, arranging them in a single layer. Sprinkle the tomatoes with the salt and remaining 1/4 teaspoon pepper. Remove the fish from the marinade and pat dry. Discard the marinade. Rub the remaining herb paste over the fish, coating both sides. Place the fish on top of the tomatoes and cover the dish tightly with aluminum foil.,Roast the fish for 30 minutes, then uncover and roast until the fish is opaque throughout when tested with the tip of a knife, 10 to 12 minutes more. Lift the fish from the baking dish and place on a large platter. Divide the vegetables among 4 warmed individual plates. Peel the skin from the top of the fish, remove the top fillet, and divide it between 2 of the plates. Lift out the center fish bone and discard. Lift the second fillet and divide it between the remaining 2 plates. Serve immediately.",Serving size: 1/2 fillet,"Total carbohydrate 13g,Dietary fiber 2g,Sodium 267mg,Saturated fat 1.5g,Total fat 9g,Trans fat 0g,Cholesterol 63mg,Protein 36g,Monounsaturated fat 5g,Calories 277,Total sugars 3.5g,Added sugars 0g"
Roasted salmon,https://www.mayoclinic.org/healthy-lifestyle/recipes/roasted-salmon/rcp-20049927,"Two 5-ounce pieces salmon with skin,2 teaspoons extra-virgin olive oil,1 tablespoon chopped chives,1 tablespoon fresh tarragon leaves (optional)","Heat oven to 425 F. Line a baking sheet with foil.,Rub salmon all over with 2 teaspoons oil. Roast skin side down on foil-lined baking sheet until fish is cooked through, about 12 minutes. After 10 minutes, check if fish flakes easily with fork. If it doesn't, continue baking for 2 more minutes.,Using a metal spatula, lift salmon off skin and place salmon on serving plate. Discard skin. Sprinkle salmon with herbs and serve.",Serving size: 1 fillet,"Total carbohydrate Trace,Dietary fiber Trace,Sodium 63mg,Saturated fat 2g,Total fat 14g,Cholesterol 78mg,Protein 28g,Monounsaturated fat 6g,Calories 244,Added sugars 0g,Trans fat 0g,Total sugars Trace,Potassium 723mg"
Roasted salmon with maple glaze,https://www.mayoclinic.org/healthy-lifestyle/recipes/roasted-salmon-with-maple-glaze/rcp-20049704,"1/4 cup maple syrup,1 garlic clove, minced,1/4 cup balsamic vinegar,2 pounds salmon, cut into 6 equal-sized fillets,1/4 teaspoon kosher or sea salt,1/8 teaspoon fresh cracked black pepper,Fresh mint or parsley for garnish","Heat the oven to 450 F. Lightly coat a baking pan with cooking spray.,In a small saucepan over low heat, mix together the maple syrup, garlic and balsamic vinegar. Heat just until hot and remove from heat. Pour half of the mixture into a small bowl to use for basting, and reserve the rest for later.,Pat the salmon dry. Place skin-side down on the baking sheet. Baste the salmon with the maple syrup mixture. Bake about 10 minutes, baste again with maple syrup mixture and bake for another 5 minutes. Continue to baste and bake until fish flakes easily, about 20 to 25 minutes total.,Transfer the salmon fillets to plates. Sprinkle with salt and black pepper, and top with reserved maple syrup mixture. Garnish with fresh mint or parsley and serve immediately.",Serving size: 1 fillet,"Calories 257,Total fat 10g,Saturated fat 1.5g,Trans fat 0g,Monounsaturated fat 3g,Cholesterol 83mg,Sodium 167mg,Total carbohydrate 10g,Dietary fiber Trace,Added sugars 8g,Protein 30g,Total sugars 9g"
Roasted squash with wild rice and cranberry,https://www.mayoclinic.org/healthy-lifestyle/recipes/roasted-squash/rcp-20122247,"4 cups diced winter squash, peeled and cut into half-inch pieces,2 teaspoons canola oil, divided,1 cup diced onion,1 cup fresh cranberries,4 cups cooked wild rice,1/4 cup chopped walnuts,1 small orange, peeled and segmented,1/2 tablespoon chopped Italian parsley,1/4 teaspoon thyme,Black pepper to taste","Heat oven to 400 F.,Place squash in a roasting pan and toss with 1 teaspoon of oil. Roast for 40 minutes or until brown.,In a hot saute pan, brown onions with remaining oil. Add cranberries and saute for 1 minute. Add remaining ingredients and saute for 4 to 5 minutes or until heated thoroughly. Serve.",Serving size: 1 cup,"Cholesterol 0mg,Calories 162,Sodium 6mg,Total fat 4g,Total carbohydrate 29g,Saturated fat 0.5g,Dietary fiber 3g,Trans fat Trace,Added sugars 0g,Monounsaturated fat 1g,Protein 5g,Total sugars 4g,Potassium 362mg"
Roasted turkey for 12,https://www.mayoclinic.org/healthy-lifestyle/recipes/roasted-turkey/rcp-20050006,"1 medium shallot, peeled and finely chopped (about 2 tablespoons),4 garlic cloves, finely chopped,Coarse ground black pepper, to taste,2 carrots, cut into bite-size pieces,2 celery stalks, chopped,2 yellow onions, chopped,1 whole turkey (about 12 pounds), thawed,8 Roma tomatoes, cut in half through stem","Heat the oven to 400 F (200 C).,In a small bowl, add the shallots, garlic and black pepper to taste. Stir until evenly mixed and set aside.,Arrange carrots, celery and onion in the bottom of a roasting pan. Unwrap the turkey from its package and remove the neck, giblets and fatty tissues from body and neck cavities. Discard giblets and fatty tissues; reserve the neck for making stock. Rinse the turkey inside and out. Pat dry with paper towels.,Place the turkey breast-side up on top of the vegetables in the roasting pan. Tuck the wing tips behind the back of the turkey. Rub the turkey with the shallot mixture. Arrange tomatoes around the outside of the turkey. Place into the middle of the oven uncovered.,Bake for 20 minutes at 400 F (200 C), then reduce the oven temperature to 325 F (about 162 C). Check the doneness after the bird has roasted about 3 to 3 1/2 hours. Turkey is done when the thigh is pierced deeply and juices run clear (180 to 185 F, or 82 C to 85 C) or when the breast muscle reaches 170 to 175 F (77 to 79 C).,While the turkey is in the oven, put the turkey neck into a small saucepan. Add 4 cups of water. Place over medium heat, cover and simmer for at least an hour, while the turkey roasts. You can use this stock to make gravy or freeze it to use later as a base for soup.,Remove the turkey from the roasting pan and set on a platter. With a slotted spoon, remove the vegetables and arrange around the turkey. Cover the turkey and vegetables tightly with aluminum foil and allow to rest for 20 minutes before carving.,Carve turkey and serve.",Serving size: About 6 ounces,"Calories 337,Total fat 9g,Saturated fat 3g,Trans fat Trace,Monounsaturated fat 2g,Cholesterol 145mg,Sodium 161mg,Total carbohydrate 8g,Dietary fiber 1g,Total sugars 3g,Added sugars 0g,Protein 56g"
