recipe_name,source_url,ingredients,directions,serving_size,nutrients
Warm chocolate souffles,https://www.mayoclinic.org/healthy-lifestyle/recipes/warm-chocolate-souffles/rcp-20049626,"1/2 cup unsweetened cocoa powder,6 tablespoons hot water,1 tablespoon unsalted butter,1 tablespoon canola oil,3 tablespoons all-purpose (plain) flour,1 tablespoon ground hazelnuts (filberts) or almonds,1/4 teaspoon ground cinnamon,3 tablespoons firmly packed dark brown sugar,2 tablespoons honey,1/8 teaspoon salt,3/4 cup 1 percent low-fat milk,4 egg whites,3 tablespoons granulated sugar,1 teaspoon powdered (confectioner's) sugar,1 cup raspberries","Heat the oven to 375 F. Lightly coat six 1-cup individual souffle dishes or ramekins with cooking spray or coat a 6-cup souffle dish with the spray.,In a small bowl, combine the cocoa and hot water, stirring until smooth. Set aside.,In a small, heavy saucepan over medium heat, melt the butter. Add the canola oil and stir to combine. Add the flour, ground hazelnuts and cinnamon and cook for 1 minute, stirring constantly with a whisk. Stir in the brown sugar, honey and salt. Gradually add the milk and cook, stirring constantly, until thickened, about 3 minutes. Remove from the heat and stir into the cocoa mixture. Let cool slightly.,In a large, thoroughly cleaned bowl, using an electric mixer on high speed, beat the egg whites until foamy. Add the granulated sugar 1 tablespoon at a time and beat until stiff peaks form. Using a rubber spatula, gently fold 1/3 of the egg whites into the cocoa mixture to lighten it. Then fold the remaining egg whites into the cocoa mixture, mixing gently only until no white streaks remain.,Gently scoop the cocoa egg white mixture into the prepared dishes (or dish). Bake until the souffle rises above the rim and is set in the center, 15 to 20 minutes for individual souffles or 40 to 45 minutes for the large souffle.,Cool the souffles on a wire rack for 10 to 15 minutes. Using a fine-mesh sieve, dust the top with the powdered sugar. Garnish with raspberries and serve immediately.",Serving size: About 1 cup,"Calories 203,Total fat 7g,Saturated fat 2g,Trans fat Trace,Monounsaturated fat 2g,Cholesterol 7mg,Sodium 106mg,Total carbohydrate 29g,Dietary fiber 4g,Total sugars 22g,Added sugars 19g,Protein 6g"
Watermelon-cranberry agua fresca,https://www.mayoclinic.org/healthy-lifestyle/recipes/watermeloncranberry-agua-fresca/rcp-20049628,"2 1/2 pounds seedless watermelon, rind removed and diced (about 7 cups),1 cup fruit-sweetened cranberry juice (sometimes called cranberry nectar),1/4 cup fresh lime juice,1 lime, cut into 6 slices","Place the melon in a blender or food processor. Process until smooth. Pass the puree through a fine-mesh sieve placed over a bowl to eliminate the pulp and clarify the juice. Pour the juice into a large pitcher. Add the cranberry and lime juices and stir to combine.,Refrigerate until very cold. Pour into tall chilled glasses and garnish each with a slice of lime.",Serving size: About 3/4 cup,"Total carbohydrate 20g,Dietary fiber 1g,Sodium 9mg,Saturated fat 0g,Total fat 0g,Cholesterol 0mg,Protein 1g,Monounsaturated fat 0g,Calories 84,Trans fat 0g,Total sugars 16g,Added sugars 0g"
Whole-grain banana bread,https://www.mayoclinic.org/healthy-lifestyle/recipes/wholegrain-banana-bread/rcp-20049955,"1/2 cup brown rice flour,1/2 cup amaranth flour,1/2 cup tapioca flour,1/2 cup millet flour,1/2 cup quinoa flour,1 teaspoon baking soda,1/2 teaspoon baking powder,1/8 teaspoon salt,3/4 cup egg substitute (or use egg whites),2 tablespoons grapeseed oil,1/2 cup raw sugar,2 cups mashed banana","Heat the oven to 350 F. Prepare a 5-by-9-inch loaf pan by spraying it lightly with cooking spray. Dust with a little of any of the flours. Set aside.,In a large bowl, mix all dry ingredients except sugar together. In a separate bowl, combine egg, oil, sugar and mashed banana. Mix well. Add wet mixture to dry ingredients and combine thoroughly. Spoon into loaf pan. Bake for 50 to 60 minutes.,Check for doneness with toothpick — when the toothpick is removed it shouldn't have any batter sticking to it. Remove bread from oven, cool, slice and serve.",Serving size: 1 slice,"Total carbohydrate 30g,Dietary fiber 2g,Sodium 146mg,Saturated fat 0.5g,Total fat 3g,Trans fat 0g,Cholesterol 0mg,Protein 4g,Monounsaturated fat 0.5g,Calories 163,Added sugars 7g,Total sugars 10g"
Zucchini bread,https://www.mayoclinic.org/healthy-lifestyle/recipes/zucchini-bread/rcp-20049730,"6 egg whites,1/4 cup canola oil,1/2 cup unsweetened applesauce,1/2 cup sugar,2 teaspoons vanilla extract,1 1/4 cups all-purpose (plain) flour,1 1/4 cups whole-wheat (whole-meal) flour,1 teaspoon baking powder,1 teaspoon baking soda,3 teaspoons ground cinnamon,2 cups shredded zucchini,1/2 cup chopped walnuts,1 1/2 cups crushed, unsweetened pineapple","Heat the oven to 350 F. Lightly coat two 9-by-5-inch loaf pans with cooking spray.,In a large bowl, add the egg whites, canola oil, applesauce, sugar and vanilla. Using an electric mixer, beat the mixture on low speed until thick and foamy.,In a small bowl, stir together the flours. Set 1/2 cup aside. Add the baking powder, baking soda and cinnamon to the small bowl of flour.,Add the flour mixture to the egg white mixture and using the electric mixer on medium speed, beat until well-blended. Add the zucchini, walnuts and pineapple and stir until combined. Adjust consistency of the batter with the remaining 1/2 cup flour, adding 1 tablespoon at a time. The batter should be thick and not runny.,Pour 1/2 of the batter into each prepared pan. Bake until a toothpick inserted into the centers of the loaves comes out clean, about 50 minutes. Let the bread cool in the pans on a wire rack for 10 minutes. Turn the loaves out of the pans onto the rack and let cool completely. Cut each loaf into 9 1-inch slices and serve.",Serving size: 1 slice,"Calories 141,Total fat 5g,Saturated fat 0.5g,Trans fat 0g,Monounsaturated fat 2g,Cholesterol 0mg,Sodium 103mg,Total carbohydrate 22g,Dietary fiber 2g,Added sugars 5g,Protein 4g"
6-grain hot cereal,https://www.mayoclinic.org/healthy-lifestyle/recipes/6-grain-hot-cereal/rcp-20197750,"1/2 cup uncooked pearl barley,1/2 cup uncooked red wheat berries,1/2 cup uncooked brown rice,1/4 cup uncooked steel cut oats,3 tablespoons uncooked quinoa,2 tablespoons of flaxseed,1/2 teaspoon kosher salt,1 1/2 quarts water","In a large saucepan, combine the barley, wheat berries, rice, oats, quinoa, flaxseed and salt. Pour water over ingredients, stir and bring to a boil over medium heat. Reduce heat to low and simmer for 45 minutes, stirring occasionally.",Serving size: 1/2 cup,"Calories 114,Total fat 1g,Saturated fat 0g,Trans fat 0g,Monounsaturated fat 0g,Cholesterol 0mg,Sodium 74mg,Total carbohydrate 21g,Dietary fiber 3g,Total sugars 0g,Protein 4g"
Almond crusted chicken,https://www.mayoclinic.org/healthy-lifestyle/recipes/almond-crusted-chicken/rcp-20197655,"3/4 cup ground almonds,1/2 cup all-purpose flour,1 teaspoon dry thyme,1 teaspoon onion powder,1 teaspoon garlic powder,1/2 teaspoon salt,1/2 teaspoon pepper,1/2 cup skim milk,4 boneless, skinless, chicken breast, 4 ounces each,1 tablespoon olive oil","Heat oven to 400 F. Lightly coat a baking sheet with cooking spray. In a medium bowl, combine the ground almonds, flour, thyme, onion powder, garlic powder, salt and pepper. Pour the milk in a separate medium-sized bowl. Coat each chicken breast in the almond mixture, then into the milk, and back into the almond mixture, and place on the baking sheet.,Preheat a nonstick saute pan on medium-high heat, and add the olive oil to the pan. Once the pan is hot, place the chicken breasts in the pan and reduce heat to medium. Sear the chicken breasts on one side until they are golden brown, then sear on the other side for 1 minute. Place chicken back on the greased baking sheet and bake in the oven for about 10 minutes or until the internal temperature reaches 165 F.",Serving size: 1 chicken breast,"Calories 250,Total fat 11g,Saturated fat 1g,Trans fat 0g,Monounsaturated fat 6g,Cholesterol 83mg,Sodium 291mg,Total carbohydrate 9g,Dietary fiber 2g,Total sugars 0g,Protein 28g"
Asian pork tenderloin,https://www.mayoclinic.org/healthy-lifestyle/recipes/asian-pork-tenderloin/rcp-20049733,"2 tablespoons sesame seeds,1 teaspoon ground coriander,1/8 teaspoon cayenne pepper,1/8 teaspoon celery seed,1/2 teaspoon minced onion,1/4 teaspoon ground cumin,1/8 teaspoon ground cinnamon,1 tablespoon sesame oil,1 pound pork tenderloin, sliced into 4 portions","Heat the oven to 400 F. Lightly coat a baking dish with cooking spray.,In a heavy frying pan, add the sesame seeds in a single layer. Over low heat, cook the seeds, stirring constantly until they look golden and give off a noticeably toasty aroma, about 1 to 2 minutes. Remove the seeds from the pan to cool.,In a bowl, add the coriander, cayenne pepper, celery seed, minced onion, cumin, cinnamon, sesame oil and toasted sesame seeds. Stir to mix evenly.,Place the pork tenderloin in the prepared baking dish. Rub the spices on both sides of the pork pieces. Bake until no longer pink, about 15 minutes. Or bake until a meat thermometer reaches 165 F (medium) or 170 F (well-done).",Serving size: 1 piece,"Total carbohydrate 1g,Dietary fiber 0g,Sodium 61mg,Saturated fat 2g,Total fat 8g,Trans fat Trace,Cholesterol 73mg,Protein 25g,Monounsaturated fat 3g,Calories 176,Added sugars 0g,Total sugars 0g"
"Asparagus, tomato and red pepper French bread pizza",https://www.mayoclinic.org/healthy-lifestyle/recipes/asparagus-tomato-and-red-pepper-french-bread-pizza/rcp-20049734,"1 cup diced asparagus,1 cup diced Roma tomatoes,1 cup diced red bell pepper,1 tablespoon minced garlic,1 loaf French bread, about 8 inches long, sliced in half and cut into 4-inch sections,1 cup pizza sauce,1 cup reduced-fat shredded mozzarella cheese","Heat the oven to 400 F. Lightly coat a baking sheet with cooking spray.,In a small bowl, add the asparagus, tomatoes and pepper. Add the garlic and toss gently to coat evenly. Arrange the French bread on the baking sheet. Add 1/4 cup of the pizza sauce and 1/4 of the vegetable mixture to each section. Sprinkle each with 1/4 cup mozzarella cheese.,Bake until the cheese is lightly browned and the vegetables are tender, about 8 to 10 minutes. Serve immediately.",Serving size: 1 4-inch section,"Calories 265,Total fat 5g,Saturated fat 2g,Trans fat 0g,Monounsaturated fat 0.5g,Cholesterol 12mg,Sodium 660mg,Total carbohydrate 40g,Dietary fiber 4g,Added sugars 0g,Protein 15g"
Baba ghanoush,https://www.mayoclinic.org/healthy-lifestyle/recipes/baba-ghanoush/rcp-20049954,"1 bulb garlic (about 8 cloves),2 eggplants, sliced lengthwise, skin removed,1 red bell pepper, halved and seeded,Juice of 1 lemon (about 4 tablespoons),1 tablespoon chopped fresh basil,1 tablespoon olive oil,1 teaspoon black pepper or to taste,2 rounds of whole-wheat pita or other flatbread","Spray cold grill with cooking spray. Heat one side of the grill to high. (Or move coals to one side of the grill.),Slice top off garlic bulb, wrap in foil and place on cooler part of grill. Roast for 20 to 30 minutes. On hot part of grill, place eggplant slices and bell pepper. Grill for 2 to 3 minutes on each side.,Squeeze roasted garlic out of bulb and place in food processor. Add grilled eggplant and red bell pepper. Add lemon juice, basil, olive oil and pepper. Pulse until smooth. Place dip in serving bowl.,Warm bread on grill for a few seconds on each side. Serve with dip.",Serving size: Half a pita and 2 tablespoons dip,"Total carbohydrate 40g,Dietary fiber 12g,Sodium 150mg,Saturated fat 1g,Total fat 5g,Trans fat 0g,Cholesterol 0mg,Protein 7g,Monounsaturated fat 2.5g,Calories 233,Added sugars 0g,Total sugars 11g"
Baked blueberry French toast,https://www.mayoclinic.org/healthy-lifestyle/recipes/baked-blueberry-french-toast/rcp-20049934,"12-inch French or sourdough baguette,4 egg whites,1 cup fat-free soy milk,1/4 teaspoon nutmeg,1 teaspoon vanilla,4 tablespoons brown sugar, divided,3/4 cup blueberries, coarsely chopped,1 tablespoon canola oil,1/4 cup chopped pecans, toasted (optional; not included in the nutritional analysis)","Spray a 9-inch square baking dish with cooking spray. Cut 10 1-inch-thick slices from baguette. Arrange in baking dish.,In a large bowl, whisk egg whites until frothy. Then whisk in milk, nutmeg, vanilla and 2 tablespoons brown sugar. Pour evenly over bread, turning slices to coat evenly. Cover pan. Chill at least 8 hours or overnight, until liquid is absorbed by bread.,Heat oven to 400 F. Drop blueberries evenly over bread. In a small bowl, stir together 2 tablespoons brown sugar and oil, and pecans if you wish. Spoon evenly over bread. Bake, uncovered, about 20 minutes, until liquid from blueberries is bubbling.",Serving size: 2 slices,"Calories 171,Total fat 3g,Saturated fat 0.5g,Trans fat 0g,Monounsaturated fat 2g,Cholesterol 0mg,Sodium 249mg,Total carbohydrate 30g,Dietary fiber 0.5g,Added sugars 10g,Protein 6g"
Baked chicken and wild rice with onion and tarragon,https://www.mayoclinic.org/healthy-lifestyle/recipes/baked-chicken-and-wild-rice-with-onion-and-tarragon/rcp-20049636,"1 pound boneless, skinless chicken breast halves,1 1/2 cups chopped celery,1 1/2 cups whole pearl onions,1 teaspoon fresh tarragon,2 cups unsalted chicken broth,3/4 cup uncooked long-grain white rice,3/4 cup uncooked wild rice,1 1/2 cups dry white wine","Heat the oven to 300 F.,Cut chicken breasts into 1-inch pieces. In a nonstick frying pan, combine the chicken, celery, onions and tarragon with 1 cup of the unsalted chicken broth. Cook on medium heat until the chicken and vegetables are tender, about 10 minutes. Set aside to cool.,In a baking dish, stir together the rice, wine and remaining 1 cup chicken broth. Let soak for 30 minutes.,Add the chicken and vegetables to the baking dish. Cover and bake for 60 minutes. Check periodically and add more broth if the rice is too dry. Serve immediately.",Serving size: About 1 1/2 cups,"Total carbohydrate 38g,Dietary fiber 2.5g,Sodium 104mg,Saturated fat 1g,Total fat 3g,Trans fat Trace,Cholesterol 55mg,Protein 23g,Monounsaturated fat 1g,Calories 313,Added sugars 0g,Total sugars 2g"
Baked cod with lemon and capers,https://www.mayoclinic.org/healthy-lifestyle/recipes/cod-with-lemon-and-capers/rcp-20049653,"4 cod fillets, each 6 ounces,1 lemon,1 teaspoon low-sodium chicken-flavored bouillon granules,1 cup hot tap water,1 tablespoon butter, softened,1 tablespoon all-purpose flour,4 teaspoons capers, rinsed and drained","Heat the oven to 350 F. Spray 4 squares of foil with cooking spray.,Place 1 cod fillet on each foil square. Cut lemon in half. Squeeze the juice from one half over the fish. Cut the other half into slices, place over the fish and seal the foil.,Bake in the oven until the fish is opaque throughout when tested with the tip of a knife, about 20 minutes.,In a small bowl, add the chicken bouillon granules and the hot tap water. Stir until the granules dissolve. Set aside.,In another small bowl, mix the butter and flour together. Transfer to a heavy saucepan. Stir over moderate heat until the butter-flour mixture melts. Add the bouillon to the butter mixture and continue to stir until thickened. Add the capers and remove from the heat. Pour over the fish and serve.",Serving size: 1 fillet,"Cholesterol 85mg,Calories 159,Sodium 294mg,Total fat 3g,Total carbohydrate 3g,Saturated fat 2g,Dietary fiber Trace,Trans fat Trace,Added sugars 0g,Monounsaturated fat 1g,Protein 30g,Total sugars Trace"
Baked macaroni with red sauce,https://www.mayoclinic.org/healthy-lifestyle/recipes/baked-macaroni-with-red-sauce/rcp-20049637,"1/2 pound extra-lean ground beef,1 small onion, diced (about 1/2 cup),1 box (7 ounces) whole-wheat elbow macaroni,1 jar (15 ounces) reduced-sodium spaghetti sauce,6 tablespoons Parmesan cheese","Heat the oven to 350 F. Lightly coat a baking dish with cooking spray.,In a nonstick frying pan, cook ground beef and onion until the meat is browned and the onion is translucent. Drain well and set aside.,Fill a large pot 3/4 full with water and bring to a boil. Add the pasta and cook until al dente, 10 to 12 minutes, or according to the package directions. Drain the pasta thoroughly.,Add the cooked pasta and spaghetti sauce to the meat and onions. Stir to mix evenly. Spoon the mixture into the prepared baking dish. Bake until bubbly, about 25 to 35 minutes.,Divide the macaroni among individual plates. Sprinkle each with 1 tablespoon Parmesan cheese. Serve immediately.",Serving size: About 1 cup,"Cholesterol 32mg,Calories 269,Sodium 125mg,Total fat 9g,Total carbohydrate 32g,Saturated fat 3g,Dietary fiber 4g,Trans fat Trace,Total sugars 6g,Monounsaturated fat 3g,Added sugars 0g,Protein 15g"
Baked oatmeal,https://www.mayoclinic.org/healthy-lifestyle/recipes/baked-oatmeal/rcp-20049931,"1 tablespoon canola oil,1/2 cup unsweetened applesauce,1/3 cup brown sugar,Egg substitute equivalent to 2 eggs, or 4 egg whites,3 cups uncooked rolled oats,2 teaspoons baking powder,1 teaspoon cinnamon,1 cup skim milk","In a good-sized bowl, stir together oil, applesauce, sugar and eggs. Add dry ingredients and milk. Mix well.,Spray a 9-by-13 baking pan generously with cooking spray. Spoon oatmeal mixture into pan. Bake uncovered at 350 F for 30 minutes.",Serving size: About 3/4 cup,"Total carbohydrate 34g,Dietary fiber 4g,Sodium 166mg,Saturated fat 1g,Total fat 4g,Potassium 235mg,Cholesterol 1mg,Protein 8g,Monounsaturated fat 2g,Calories 209,Trans fat Trace,Added sugars 6g,Total sugars 9g"
Baked salmon with Southeast Asian marinade,https://www.mayoclinic.org/healthy-lifestyle/recipes/baked-salmon-with-southeast-asian-marinade/rcp-20049736,"1/2 cup pineapple juice (no sugar added),2 garlic cloves, minced,1 teaspoon low-sodium soy sauce,1/4 teaspoon ground ginger,2 salmon fillets, each 4 ounces,1/4 teaspoon sesame oil,Freshly ground black pepper, to taste,1 cup diced fresh fruit, such as pineapple, mango and papaya","In a small bowl, add the pineapple juice, garlic, soy sauce and ginger. Stir to mix evenly. Arrange the salmon fillets in a small baking dish. Pour the pineapple juice mixture over the top. Put in the refrigerator and marinate for 1 hour. Turn the salmon periodically as needed.,Heat the oven to 375 F. Lightly coat 2 squares of aluminum foil with cooking spray. Place the marinated salmon fillets on the aluminum foil. Drizzle each with 1/8 teaspoon sesame oil. Sprinkle with pepper and top each with 1/2 cup diced fruit. Wrap the foil around the salmon, folding the edges to seal. Bake until the fish is opaque throughout when tested with the tip of a knife, about 10 minutes on each side. Transfer the salmon to warmed individual plates and serve immediately.",Serving size: 1 fillet,"Calories 247,Total fat 7g,Saturated fat 1g,Trans fat Trace,Monounsaturated fat 3g,Cholesterol 57mg,Sodium 192mg,Total carbohydrate 19g,Dietary fiber 2g,Added sugars 0g,Protein 27g"
Baked ziti with vegetables,https://www.mayoclinic.org/healthy-lifestyle/recipes/baked-ziti-with-vegetables/rcp-20049737,"2/3 cup uncooked ziti (about 2 ounces),1 can (14 ounces) low-sodium tomatoes, drained (reserve 1/2 cup of the juice),1/2 cup sliced carrots,1 cup chopped broccoli,1/2 cup diced green bell pepper,1/4 cup sliced mushrooms,2 garlic cloves, minced,1 teaspoon dried basil,1 teaspoon dried oregano,1/2 teaspoon ground black pepper,1/2 cup reduced-fat shredded mozzarella cheese,1/2 cup grated Parmesan cheese","Heat the oven to 375 F. Lightly coat a baking dish with cooking spray.,Fill a large pot 3/4 full with water and bring to a boil. Add the pasta and cook until al dente (tender), 10 to 12 minutes, or according to the package directions. Drain the pasta thoroughly.,In a nonstick frying pan over medium heat, add the reserved juice from the canned tomatoes. Stir in the carrots, broccoli and green pepper. Saute the vegetables until tender, about 5 minutes. Add the mushrooms and garlic and cook for another 5 minutes. Add the tomatoes, basil, oregano and black pepper to the vegetable mixture. Cook over low heat for 3 to 5 minutes.,Transfer the cooked vegetables to a large bowl. Add the cooked pasta and shredded mozzarella cheese. Toss gently to mix. Spoon the mixture into the prepared baking dish. Sprinkle with the grated Parmesan cheese. Cover with aluminum foil and bake until the mixture is hot and bubbly, about 30 minutes. Remove the aluminum foil after 15 minutes. Divide the pasta among warmed individual bowls. Serve immediately.",Serving size: About 2 1/2 cups,"Total fat 6g,Calories 286,Protein 16g,Cholesterol 11mg,Total carbohydrate 42g,Dietary fiber 8g,Monounsaturated fat Trace,Saturated fat 2g,Added sugars 0g,Sodium 334mg,Trans fat 0g"
Balsamic feta chicken,https://www.mayoclinic.org/healthy-lifestyle/recipes/balsamic-feta-chicken/rcp-20197661,"6 chicken breasts, 4 ounces each,1/2 cup balsamic vinegar,2 tablespoons brown sugar,1 tablespoon olive oil,1 tablespoon paprika,1 teaspoon chopped fresh thyme,1/2 teaspoon kosher salt,1/4 teaspoon dry mustard,6 tablespoons crumbled feta cheese","Heat the oven to 375 F. Lightly coat a baking sheet or baking dish with cooking spray or olive oil.,In a medium bowl, combine the chicken breasts, vinegar, brown sugar, oil, paprika, thyme, salt and mustard. Using tongs, coat the chicken. Marinate the chicken breasts for at least 20 minutes in the refrigerator.,Place the marinaded chicken breasts on the baking sheet and bake for 15 minutes or until chicken reaches an internal temperature of 165 F. Sprinkle each chicken breast with 1 tablespoon cheese and serve.",Serving size: 1 breast,"Calories 279,Total fat 15g,Saturated fat 4g,Trans fat 0g,Monounsaturated fat 6g,Cholesterol 79mg,Sodium 337mg,Total carbohydrate 9g,Dietary fiber 1g,Total sugars 8g,Protein 25g"
Balsamic roast chicken,https://www.mayoclinic.org/healthy-lifestyle/recipes/balsamic-roast-chicken/rcp-20049638,"1 whole chicken, about 4 pounds,1 tablespoon fresh rosemary or 1 teaspoon dried rosemary,1 garlic clove,1 tablespoon olive oil,1/8 teaspoon freshly ground black pepper,8 sprigs fresh rosemary,1/2 cup balsamic vinegar,1 teaspoon brown sugar","Heat the oven to 350 F.,Mince together the rosemary and garlic. Loosen the chicken skin from the flesh, and rub the flesh with olive oil and then the herb mixture. Sprinkle with black pepper. Put 2 rosemary sprigs into the cavity of the chicken. Truss the chicken.,Place the chicken into a roasting pan and roast for 20 to 25 minutes per pound, about 1 hour and 20 minutes. Whole chicken should cook to a minimum internal temperature of 165 F. Baste frequently with pan juices. When the chicken is browned and the juices run clear, transfer the chicken to a serving platter.,In a small saucepan, combine the balsamic vinegar and brown sugar. Heat until the mixture is warmed and brown sugar dissolves, but don't boil.,Carve the chicken and remove the skin. Top the pieces with the vinegar mixture. Garnish with the remaining rosemary and serve immediately.",Serving size: 1/8 chicken,"Cholesterol 127mg,Calories 301,Sodium 131mg,Total fat 13g,Total carbohydrate 3g,Saturated fat 3g,Dietary fiber Trace,Trans fat 0g,Total sugars 3g,Monounsaturated fat 5g,Added sugars Trace,Protein 43g"
Barbecue chicken pizza,https://www.mayoclinic.org/healthy-lifestyle/recipes/barbecue-chicken-pizza/rcp-20049639,"1 cup tomato sauce, no salt added,One 12-inch thin, whole-grain pizza crust,1 green pepper, cut into rings,1 tomato, sliced,1 cup mushrooms, sliced,4 ounces cooked chicken breast, sliced about 1-inch thick, with all visible fat removed,4 tablespoons barbecue sauce,1 cup shredded, reduced-fat mozzarella cheese (about 4 ounces)","Heat the oven to 400 F.,Spread the sauce evenly over the pizza crust. Add the pepper, tomato, mushrooms and chicken. Drizzle barbecue sauce over the pizza and top with cheese.,Bake about 12 to 14 minutes. Cut the pizza into 8 slices and serve.",Serving size: 2 slices,"Total carbohydrate 28g,Dietary fiber 5g,Sodium 475mg,Saturated fat 3g,Total fat 7g,Trans fat 0g,Cholesterol 41mg,Protein 21g,Monounsaturated fat 2g,Calories 261,Added sugars 0g,Total sugars 0g"
