recipe_name,source_url,ingredients,directions,serving_size,nutrients
Steak salad with roasted corn vinaigrette,https://www.mayoclinic.org/healthy-lifestyle/recipes/grilled-flank-steak-salad-with-roasted-corn-vinaigrette/rcp-20049873,"3 cups fresh corn kernels (cut from 4 or 5 ears of corn) or frozen corn kernels, thawed,1/2 cup water,2 tablespoons fresh lime juice,2 tablespoons chopped red bell pepper,2 tablespoons extra-virgin olive oil,1/2 teaspoon salt,1/2 teaspoon freshly ground black pepper,1/4 cup chopped fresh cilantro (fresh coriander),1 tablespoon ground cumin,2 teaspoons dried oregano,1/4 teaspoon red pepper flakes,3/4 pound (12 ounces) flank steak,1 large head romaine lettuce, trimmed and torn into bite-sized pieces (about 6 cups),4 cups cherry tomatoes, halved,3/4 cup thinly sliced red onion,1 1/2 cups cooked black beans, no salt added","Place a dry, large cast-iron or heavy nonstick frying pan over medium-high heat. Add the corn and cook, stirring often, until the corn begins to brown, 4 to 5 minutes. Remove from the heat and set aside.,In a food processor, combine the water, lime juice, bell pepper and 1 cup of the roasted corn. Pulse to puree. Add the olive oil, 1/4 teaspoon of the salt, 1/4 teaspoon of the black pepper and the cilantro. Pulse to blend. Set the vinaigrette aside.,Prepare a hot fire in a charcoal grill or heat a gas grill or broiler (grill). Away from the heat source, lightly coat the grill rack or broiler pan with cooking spray. Position the cooking rack 4 to 6 inches from the heat source.,In a small bowl, mix together the cumin, oregano, red pepper flakes and the remaining 1/4 teaspoon salt and 1/4 teaspoon black pepper. Rub on both sides of the steak. Place the steak on the grill rack or broiler pan and grill or broil, turning once, until browned, 4 to 5 minutes on each side. Cut into the center to check for doneness (medium doneness is 160 F if using a meat thermometer). Let stand for 5 minutes. Cut across the grain into thin slices. Cut the slices into pieces 2 inches long.,In a large bowl, combine the lettuce, tomatoes, onion, black beans and remaining roasted corn. Add the vinaigrette and toss gently to mix well and coat evenly.,To serve, divide the salad among individual plates. Top each serving with slices of grilled steak.",Serving size: About 2 1/2 cups salad topped with 2 ounces grilled steak,"Total carbohydrate 37g,Dietary fiber 9g,Sodium 249mg,Saturated fat 2g,Total fat 9g,Trans fat 0g,Cholesterol 36mg,Protein 21g,Monounsaturated fat 5g,Calories 295,Total sugars 7g,Added sugars 0g"
Tabbouleh salad,https://www.mayoclinic.org/healthy-lifestyle/recipes/tabbouleh-salad-cracked-wheat-salad/rcp-20049723,"1 1/2 cups water,3/4 cup bulgur (cracked wheat), rinsed and drained,1 cup diced, seeded tomatoes,1/2 cup chopped scallions or green onions,1 cup finely diced cucumber,8 olives, green or black, sliced,1 cup chopped parsley,1/4 cup chopped mint or basil, optional,1 teaspoon dill weed, optional,1/4 cup lemon juice,2 tablespoons extra-virgin olive oil,Freshly ground black pepper, to taste","In a small saucepan, bring the water to a boil. Remove from heat and add the bulgur. Cover and let stand until the bulgur is tender and the liquid is completely absorbed, about 15 to 20 minutes.,In a large bowl, add the bulgur and the remaining ingredients. Toss gently just until the ingredients are evenly distributed. Cover and refrigerate for 2 hours to allow the flavors to blend. Serve chilled.",Serving size: About 2/3 cup,"Total fat 4g,Calories 92,Protein 2g,Cholesterol 0mg,Total carbohydrate 13g,Dietary fiber 3g,Monounsaturated fat 3g,Saturated fat 0.5g,Added sugars 0g,Sodium 51mg,Trans fat 0g,Potassium 195mg,Total sugars 1g"
"Tossed greens with pasta, fruit and balsamic vinaigrette",https://www.mayoclinic.org/healthy-lifestyle/recipes/tossed-greens-with-pasta-fruit-and-balsamic-vinaigrette/rcp-20049840,"1 teaspoon dried rosemary or 1 tablespoon fresh rosemary,1/4 teaspoon ground cinnamon,1/4 teaspoon salt,3 tablespoons balsamic vinegar,1/4 cup olive oil,4 ounces uncooked whole-wheat spiral pasta,6 cups mixed greens,2 large fresh pears, cored and sliced,1/2 cup sliced water chestnuts,1/2 cup golden raisins,3 tablespoons roasted unsalted soy nuts","Use a small bowl to make the dressing. Add the rosemary, cinnamon, salt, balsamic vinegar and olive oil; whisk thoroughly to blend.,Fill a large pot 3/4 full with water and bring to a boil. Add the pasta and cook until tender (al dente), 10 to 12 minutes, or according to the package directions. Drain the pasta thoroughly and rinse under cold water.,In large bowl, combine the cooked pasta, mixed greens, pears, water chestnuts and raisins. Whisk the dressing again briefly and add to the salad. Toss to coat evenly. Divide the salad onto individual plates and top with soy nuts. Serve immediately.",Serving size: About 2 cups,"Calories 274,Total fat 10g,Saturated fat 1g,Trans fat 0g,Monounsaturated fat 7g,Cholesterol 0mg,Sodium 136mg,Total carbohydrate 40g,Dietary fiber 6g,Total sugars 16g,Added sugars 0g,Protein 6g"
Tuna pasta salad,https://www.mayoclinic.org/healthy-lifestyle/recipes/tuna-pasta-salad/rcp-20049841,"2 tablespoons extra-virgin olive oil,2 tablespoons lemon juice,2 tablespoons red wine vinegar,1 tablespoon Dijon mustard,1 garlic clove, minced,2 cups uncooked whole-wheat bow tie pasta (farfalle),2 cans (6 ounces each) unsalted white tuna packed in water, drained,1/4 cup finely chopped onions,2/3 cup frozen peas, thawed,1/8 teaspoon ground black pepper, if desired,4 cups fresh spinach",,Serving size: About 1 cup,"Calories 334,Total fat 10g,Saturated fat 2g,Trans fat 0g,Monounsaturated fat 2g,Cholesterol 36mg,Sodium 220mg,Total carbohydrate 32g,Dietary fiber 5g,Total sugars 3g,Added sugars 0g,Protein 29g"
Warm coleslaw with honey dressing,https://www.mayoclinic.org/healthy-lifestyle/recipes/warm-coleslaw-with-honey-dressing/rcp-20049627,"6 teaspoons olive oil,1 medium yellow onion, finely chopped (about 1/2 cup),1 teaspoon dry mustard,1 large carrot, peeled and julienned (about 1 cup),1/2 head napa cabbage, cored and thinly sliced crosswise (about 5 cups),3 tablespoons cider vinegar,1 tablespoon dark honey,1/4 teaspoon salt,1/4 teaspoon freshly ground black pepper,1/2 teaspoon caraway seed,1 tablespoon chopped fresh flat-leaf (Italian) parsley","In a large nonstick saute pan, heat 2 teaspoons of the olive oil over medium-high heat until hot but not smoking. Add the onion and mustard and saute until the onion is soft and lightly golden, about 6 minutes. Transfer to a large bowl.,Reduce the heat to medium and add 2 more teaspoons of the olive oil to the pan. Add the carrot and toss and stir constantly until the carrot is tender-crisp, about 3 minutes. Transfer to the bowl with the onion.,Add the remaining 2 teaspoons oil to the pan over medium heat. Add the cabbage and toss and stir constantly until the cabbage just begins to wilt, about 3 minutes. Quickly transfer the cabbage to the bowl with the other vegetables.,Quickly add the vinegar and honey to the pan over medium heat, stirring until combined and bubbly and the honey is dissolved. Pour over the slaw. Add the salt and pepper and toss well. Garnish with the caraway seed and parsley and serve warm.",Serving size: About 1 cup,"Calories 74,Total fat 5g,Saturated fat 1g,Trans fat 0g,Monounsaturated fat 3g,Cholesterol 0mg,Sodium 117mg,Total carbohydrate 8g,Dietary fiber 2g,Total sugars 5g,Added sugars 3g,Protein 1g"
Yellow pear and cherry tomato salad,https://www.mayoclinic.org/healthy-lifestyle/recipes/yellow-pear-and-cherry-tomato-salad/rcp-20049629,"2 tablespoons sherry vinegar or red wine vinegar,1 tablespoon minced shallot,1 tablespoon extra-virgin olive oil,1/4 teaspoon salt,1/8 teaspoon freshly ground black pepper,1 1/2 cups yellow pear tomatoes, halved,1 1/2 cups orange cherry tomatoes, halved,1 1/2 cups red cherry tomatoes, halved,4 large fresh basil leaves, cut into slender ribbons","To make the vinaigrette, in a small bowl, combine the vinegar and shallot and let stand for 15 minutes. Then add the olive oil, salt and pepper and whisk until well blended.,In a large serving or salad bowl, toss together all the tomatoes.,Pour the vinaigrette over the tomatoes, add the basil shreds and toss gently to mix well and coat evenly.,Serve immediately.",Serving size: About 3/4 cup,"Calories 45,Total carbohydrate 5g,Total sugars 2g,Added sugars 0g,Dietary fiber 1.5g,Protein 1.5g,Total fat 3g,Saturated fat 0g,Total fat 0g,Monounsaturated fat 2g,Polyunsaturated fat 0g,Cholesterol 0mg,Sodium 125mg,Potassium 341mg,Calcium 14mg,Magnesium 15mg,Vitamin D 0IU,Iron 0.5mg"
Beet burgers,https://www.mayoclinic.org/healthy-lifestyle/recipes/beet-burgers/rcp-20125133,"1 teaspoon cumin,3 large red beets (about 1 pound),1/2 teaspoon coriander,1 tablespoon canola oil,1/2 teaspoon dried thyme,4 cloves garlic, minced,1/4 cup barley flour,1 cup yellow onion, diced small,2 tablespoons cider vinegar,Chia gel (1 tablespoon Chia seeds mixed with 3 tablespoons water),2 cups canned black beans, rinsed and drained,1/2 cup millet (cooked),1 cup portabella mushrooms, diced,1 tablespoon smoked paprika,2 teaspoons brown mustard,11 small whole wheat hamburger buns","Heat oven to 400 F. Wrap the beets loosely in aluminum foil and roast until easily pierced with a fork, 50 to 60 minutes. Set aside to cool.,Heat oil in a skillet over medium-high heat. Add the garlic and cook until it is fragrant, about 30 seconds. Add onions and cook on medium heat for 10 to 12 minutes until dark and caramelized. Pour in the cider vinegar and scrape up the fond. Continue to simmer until the cider has evaporated and the pan is nearly dry again. Remove from heat and set aside to cool.,Split the beans in half, pulse half in a food processor. Place the other half in a large bowl.,Use the edge of a spoon or a paper towel to scrape the skins off the cooled roasted beets; the skins should slip off easily. Grate the peeled beets on the largest holes of a box grater. Transfer the beet gratings to a strainer set over the sink. Press and squeeze the beet gratings to remove as much liquid as possible from the beets. (You can do this over a bowl and save the beet juice for another purpose.),Transfer the squeezed beets, cooked millet, mushrooms and sauteed onions to the bowl with the beans. Sprinkle the smoked paprika, brown mustard, cumin, coriander and thyme over the top of the mixture. Mix all the ingredients until combined. Taste the mixture and add pepper, or any additional spices or flavorings to taste.,Finally, add the barley flour and Chia gel and mix until you no longer see any flour. Form the mixture into 11 patties of approximately 6 ounces each. Bake at 350 for 15 minutes.,Serve burger on a whole-wheat bun.",Serving size: 1 patty with bun,"Calories 221,Total fat 5g,Saturated fat Trace,Trans fat Trace,Monounsaturated fat 1g,Cholesterol 0mg,Sodium 300mg,Total carbohydrate 34g,Dietary fiber 8g,Added sugars 0g,Protein 10g"
Black bean burgers with chipotle ketchup,https://www.mayoclinic.org/healthy-lifestyle/recipes/black-bean-burgers-with-chipotle-ketchup/rcp-20049605,"1 1/4 cups dried black beans, picked over and rinsed, soaked overnight, and drained,3 cups water,1 bay leaf,2 plum (Roma) tomatoes, peeled and seeded, then diced,1 yellow onion, chopped,4 cloves garlic, minced,1 tablespoon tomato paste,1 tablespoon wine vinegar,1 chipotle chili in adobo sauce, minced,1 3/4 teaspoons ground cumin,1/2 teaspoon salt,1 1/2 tablespoons canola oil,1/2 red bell pepper (capsicum), seeded and chopped,1/2 cup cooked brown rice,1/4 cup chopped pecans,1 green (spring) onion, thinly sliced,1 egg, lightly beaten,3/4 cup fresh whole-grain bread crumbs,6 whole-grain hamburger buns,6 slices tomato,6 slices red onion,3 bibb lettuce leaves, halved","In a large saucepan over high heat, combine the beans, water and bay leaf. Bring to a boil. Reduce the heat to low, cover partially, and simmer until the beans are tender, 60 to 70 minutes. Drain and discard the bay leaf.,While the beans are cooking, make the chipotle ketchup. In a small saucepan over medium-high heat, combine the tomatoes, half the yellow onion, half the garlic, the tomato paste, vinegar, chipotle chili, 3/4 teaspoon of the cumin and 1/4 teaspoon of the salt. Bring the mixture to a boil. Reduce the heat to medium and simmer uncovered, stirring occasionally, until the liquid is reduced and the mixture is a thick sauce, about 5 minutes. Set aside to cool.,In a frying pan, heat 1/2 tablespoon of the canola oil over medium heat. Add the remaining yellow onion and saute until soft and translucent, about 4 minutes. Add the bell pepper and the remaining garlic and saute until they begin to soften, about 3 minutes. Stir in 1/4 teaspoon of the salt, transfer the mixture to a bowl and let cool. Set the pan aside.,In a food processor, combine the drained beans, onion mixture, brown rice, pecans, green onion and the remaining 1 teaspoon cumin. Pulse several times until the mixture is coarsely pureed. Fold in the beaten egg and bread crumbs. Form the mixture into 6 patties, each about 3/4-inch thick.,In the same pan used for the onion mixture, heat the remaining 1 tablespoon canola oil over medium-high heat. Add the patties and cook, turning once, until nicely browned on both sides and heated through, 7 to 9 minutes total.,Serve each burger on a bun topped with 1 tomato slice, 1 onion slice, 1/2 lettuce leaf and a dollop of the ketchup.",Serving size: 1 prepared burger,"Calories 432,Total fat 12g,Saturated fat 2g,Trans fat Trace,Monounsaturated fat 6g,Cholesterol 31mg,Sodium 538mg,Total carbohydrate 64g,Dietary fiber 10g,Total sugars 7g,Added sugars 0g,Protein 17g"
Buffalo chicken salad wrap,https://www.mayoclinic.org/healthy-lifestyle/recipes/buffalo-chicken-salad-wrap/rcp-20049975,"3 4-ounce chicken breasts (12 ounces total),2 whole chipotle peppers,1/4 cup white wine vinegar,1/4 cup low-calorie mayonnaise,2 stalks celery, diced (about 1/2 cup),2 carrots, cut into matchsticks (about 1/2 cup),1 small yellow onion, diced (about 1/2 cup),1/2 cup raw rutabaga or jicama, cut into matchsticks,4 ounces raw spinach, chopped (about 4 cups),2 whole-grain tortillas (12-inch diameter)","Heat oven to 375 F or start grill. Bake or grill chicken breasts for about 10 minutes on each side until interior temperature is 165 F. Remove, cool and cube chicken.,In a blender, puree chipotle peppers with white wine vinegar and mayonnaise. Place all ingredients except spinach and tortillas in a bowl and mix thoroughly.,Place 2 ounces spinach and half the chicken mixture in each tortilla and wrap. Cut each wrap in half to serve.",Serving size: 1/2 wrap,"Total carbohydrate 21g,Dietary fiber 9g,Sodium 374mg,Saturated fat 1g,Total fat 7g,Trans fat Trace,Cholesterol 66mg,Protein 25g,Monounsaturated fat 2g,Calories 247,Added sugars 0g,Total sugars 3g"
Chicken and coleslaw wrap,https://www.mayoclinic.org/healthy-lifestyle/recipes/chicken-and-coleslaw-wrap/rcp-20049756,"1 tablespoon olive oil,2 tablespoons apple cider vinegar,1/4 teaspoon celery seeds (or caraway seeds),1/2 teaspoon sugar,1 can (5 ounces) chunky white meat chicken in water, drained,1 cup shredded cabbage (or packaged coleslaw mix without dressing),1 can (4 ounces) crushed pineapple, drained,2 whole-grain tortillas, each 8 inches in diameter","In a small bowl, mix together the dressing, chicken, cabbage and pineapple. Cover and refrigerate for at least 25 minutes.,To serve, divide the chicken mixture between the two tortillas. Fold the sides of each tortilla up over the filling, and then roll to close. Serve immediately.",Serving size: 1 wrap,"Total fat 14g,Calories 324,Protein 25g,Cholesterol 47mg,Total carbohydrate 26g,Dietary fiber 13g,Monounsaturated fat 8g,Saturated fat 2g,Trans fat 0g,Sodium 475mg,Total sugars 8g,Added sugars 2g"
Chicken burritos,https://www.mayoclinic.org/healthy-lifestyle/recipes/chicken-burritos/rcp-20049979,"1 teaspoon oil,1 red bell pepper, chopped,1 jalapeno pepper, seeded and chopped,2 ribs celery, chopped,1 yellow onion, chopped,2 tablespoons cumin seed,1 pint (2 cups) grape tomatoes 2 tablespoons fresh oregano,2 cloves garlic, chopped,8 ounces cooked chicken breast meat,4 whole-wheat tortillas (10-inch diameter),1/2 cup canned (no-salt-added) black beans, drained and rinsed,2 cups shredded green cabbage","In a large skillet over medium-high heat, add oil and saute peppers, celery, onion and cumin until lightly brown, about 10 to 15 minutes. Add tomatoes, oregano and garlic. Continue to saute until tomatoes blister and break open, about 5 to 10 minutes. Transfer contents to a blender and puree until desired consistency.,Pull apart breast meat from chicken and divide among tortillas. Top with beans, cabbage and sauce. Roll up and enjoy.",Serving size: 1 burrito,"Total carbohydrate 38g,Dietary fiber 9g,Sodium 382mg,Saturated fat 1g,Total fat 6g,Trans fat Trace,Cholesterol 41mg,Protein 20g,Monounsaturated fat 3g,Calories 286,Added sugars 0g,Total sugars 9g"
Chicken Caesar pitas,https://www.mayoclinic.org/healthy-lifestyle/recipes/chicken-caesar-pitas/rcp-20049754,"1 can (5 ounces) chunky white meat chicken packed in water, drained,3/4 cup shredded romaine lettuce,1 Roma tomato, chopped (about 3/4 cup),2 tablespoons grated fresh Parmesan cheese,1/4 cup fat-free Caesar dressing,1 whole-wheat pita","In a small bowl, add the chicken, lettuce, tomato, Parmesan cheese and Caesar dressing. Toss to mix evenly. Cover and place in the refrigerator for 10 minutes.,Cut the pita in half. Fill each half with the chicken mixture. Serve immediately.",Serving size: 1 pita half,"Total fat 6g,Calories 274,Protein 28g,Cholesterol 65mg,Total carbohydrate 27g,Dietary fiber 4g,Monounsaturated fat 2g,Saturated fat 2g,Trans fat Trace,Sodium 622mg,Total sugars 5g,Added sugars 0g"
Chicken sliders,https://www.mayoclinic.org/healthy-lifestyle/recipes/chicken-sliders/rcp-20049963,"10 ounces ground chicken breast,1 tablespoon black pepper,1 tablespoon minced garlic,1 tablespoon balsamic vinegar,1/2 cup minced onion,1 fresh chili pepper, minced,1 tablespoon fennel seed, crushed,4 whole-wheat mini buns,4 lettuce leaves,4 tomato slices","Mix first 7 items together and refrigerate for 1 hour. Form into 4 patties. Grill or broil in oven until a minimum internal temperature of 165 F is reached.,Serve on small whole-wheat buns with lettuce and tomato.",Serving size: 1 burger on bun with lettuce and tomato,"Total carbohydrate 25g,Dietary fiber 3g,Sodium 183mg,Saturated fat < 1g,Total fat 4g,Trans fat Trace,Cholesterol 51mg,Protein 22g,Monounsaturated fat 2g,Calories 224,Added sugars 0g,Total sugars 6g"
Grilled portobello mushroom burgers,https://www.mayoclinic.org/healthy-lifestyle/recipes/grilled-portobello-mushroom-burgers/rcp-20049669,"4 large portobello mushroom caps, 5 inches in diameter (about 16 ounces total),1/3 cup balsamic vinegar,1/2 cup water,1 tablespoon sugar,1 garlic clove, minced,1/4 teaspoon cayenne pepper, optional,2 tablespoons olive oil,4 whole-wheat buns, toasted,4 slices tomato,4 slices red onion,2 bibb lettuce leaves, halved","Clean mushrooms with a damp cloth and remove their stems. Place in a glass dish, stem (gill) side up.,To prepare the marinade, in a small bowl whisk together the vinegar, water, sugar, garlic, cayenne pepper and olive oil. Pour over the mushrooms. Cover and marinate in the refrigerator for about 1 hour, turning mushrooms once.,Prepare a hot fire in a charcoal grill or heat a gas grill or broiler. Away from the heat source, lightly coat the grill rack or broiler pan with cooking spray. Position the cooking rack 4 to 6 inches from the heat source.,Grill or broil the mushrooms on medium heat, turning often, until tender, about 5 minutes on each side. Baste with marinade to keep from drying out. Using tongs, transfer the mushrooms to a plate.,Place each mushroom on a bun and top with 1 tomato slice, 1 onion slice and 1/2 lettuce leaf. Serve immediately.","Serving size: 1 ""burger""","Total carbohydrate 39g,Dietary fiber 6g,Sodium 262mg,Saturated fat 21g,Total fat 9g,Trans fat Trace,Cholesterol 0mg,Protein 9g,Monounsaturated fat 5g,Calories 273,Added sugars 3g,Total sugars 11g"
Grilled salmon on sourdough bread,https://www.mayoclinic.org/healthy-lifestyle/recipes/grilled-salmon-on-sourdough-bread/rcp-20049670,"2 lemons, thinly sliced,4 salmon fillets, each 4 ounces,2 tablespoons salt-free Italian seasoning,4 teaspoons reduced-fat mayonnaise,1 tablespoon chopped fresh basil,4 slices sourdough bread,1 garlic clove,1 tablespoon olive oil,1 tomato, thinly sliced,4 Boston lettuce leaves","Prepare a hot fire in a charcoal grill or heat a gas grill or broiler.,Away from the heat source, wrap the grill rack or broiler pan with foil. Arrange the lemon slices in a single layer on the foil, overlapping slightly.,Sprinkle the salmon fillets with Italian seasoning. Place the fillets on the layer of lemon slices and grill or broil until the fish is opaque throughout when tested with the tip of a knife, about 15 to 20 minutes.,In a small bowl, mix together the mayonnaise and basil. Set aside.,Brush one side of each slice of sourdough bread with olive oil and grill or broil (oil side toward heat) until lightly browned. Remove from heat and rub oiled side with garlic clove.,Spread mayo mixture on each slice of the sourdough bread. Place salmon on a slice of bread and top with tomato and lettuce. Serve open-faced.",Serving size: 1 sandwich,"Total carbohydrate 22g,Dietary fiber 4g,Sodium 205mg,Saturated fat 2g,Total fat 13g,Trans fat 0g,Cholesterol 64mg,Protein 26g,Monounsaturated fat 6g,Calories 309,Added sugars 0g,Total sugars 3g"
Philly steak sandwich,https://www.mayoclinic.org/healthy-lifestyle/recipes/philly-steak-sandwich/rcp-20049801,"1/2 green pepper, thinly sliced,1/2 small onion, thinly sliced,6 ounces lean roast beef, shaved,2 whole-wheat buns,1/4 cup cheddar cheese, shredded","Heat the oven to 350 F. Lightly coat a baking pan with cooking spray. Spray a frying pan with cooking spray.,Over medium heat, saute the peppers and onions until they soften, 3 to 5 minutes. Add the roast beef and saute for an additional 2 to 3 minutes.,Place 1/2 of the roast beef mixture on the bottom half of each bun. Place in the prepared baking dish. Top each bun with 2 tablespoons of the cheese. Bake until the cheese has melted, 2 to 4 minutes. Remove and add the top of bun and serve.",Serving size: 1 sandwich,"Calories 350,Total fat 14g,Saturated fat 6g,Trans fat 0.5g,Monounsaturated fat 5g,Cholesterol 85mg,Sodium 323mg,Total carbohydrate 23g,Dietary fiber 3g,Total sugars 8g,Added sugars 0g,Protein 33g"
Sloppy Joes,https://www.mayoclinic.org/healthy-lifestyle/recipes/sloppy-joes/rcp-20049822,"1 pound ground beef (90 percent lean),1 large green bell pepper, chopped (about 1 cup),1 large onion, chopped (about 1 cup),1 1/2 cans (10.75 ounces each) reduced-sodium tomato soup (not diluted),6 whole-wheat hamburger buns","In a nonstick frying pan, cook the ground beef, pepper and onion until the meat is browned and the vegetables are tender, 7 to 10 minutes. Drain well and return the mixture to the frying pan. Add the tomato soup to the ground beef mixture and stir well. Simmer for at least 10 minutes.,To serve, place 2/3 cup of the meat mixture on each bun. Serve immediately.",Serving size: 1 sandwich,"Calories 251,Total fat 9g,Saturated fat 3g,Trans fat 0.5g,Monounsaturated fat 4g,Cholesterol 49mg,Sodium 203mg,Total carbohydrate 28g,Dietary fiber 4g,Total sugars 10g,Added sugars 0g,Protein 19g"
Smoked Gouda and vegetable poached egg sandwich,https://www.mayoclinic.org/healthy-lifestyle/recipes/smoked-gouda-and-vegetable-poached-egg-sandwich/rcp-20197751,"1 cup sliced red bell peppers,1 cup sliced onions,3 whole-wheat English muffins,3 ounces smoked Gouda cheese, sliced,6 cups water,1 tablespoon white vinegar,6 large eggs,1/4 teaspoon kosher salt","Heat the oven to 425 F. Place bell peppers in the oven and roast for 10 to 15 minutes until the skin of the peppers begins to bubble and turns brown or black.,Meanwhile, heat a medium saute pan over medium heat and cook the onions for about 6 minutes until caramelized; set aside and keep warm.,Place the peppers in a medium bowl and cover with plastic wrap; set aside. When the peppers are cool to the touch, remove the skin. Cut the English muffins in half and top with cheese, peppers and onions. Place on a baking sheet and bake for about 5 minutes.,To prepare the eggs, first bring the water to a simmer in a medium-sized pan that's shallow and wide. Add the vinegar. Slowly crack the eggs and add to the pan one at a time and cook to desired doneness. Eggs that have runny yolks take about 3 to 4 minutes. Using a slotted spoon, retrieve the eggs from the water. Place an egg on each English muffin half and sprinkle with salt.",Serving size: 1 sandwich,"Calories 207,Total fat 10g,Saturated fat 4g,Trans fat 0g,Monounsaturated fat 2g,Cholesterol 201mg,Sodium 360mg,Total carbohydrate 18g,Dietary fiber 3g,Total sugars 5g,Protein 13g"
